Ashraf,Nusairat,"Sunday: montelukast x1 vitamin c x1 vitamin b x1 levocitrizine x1 tylenol x1 ; Monday: montelukast x1 vitamin c x1 vitamin b x1 levocitrizine x1 ; Tuesday: montelukast x1 vitamin c x1 vitamin b x1 levocitrizine x1 ; Wednesday: montelukast x1 vitamin c x1 vitamin b x1 levocitrizine x1 ; Thursday: montelukast x1 vitamin c x1 vitamin b x1 levocitrizine x1 ; Friday: montelukast x1 levocitrizine x1 ; Saturday: montelukast x1 levocitrizine x1 ",false
Ashraf,Nusairat,"Sunday: montelukast x1 vitamin c x1 vitamin b x1 levocitrizine x1 tylenol x1 ; Monday: montelukast x1 vitamin c x1 vitamin b x1 levocitrizine x1 ; Tuesday: montelukast x1 vitamin c x1 vitamin b x1 levocitrizine x1 ; Wednesday: montelukast x1 vitamin c x1 vitamin b x1 levocitrizine x1 ; Thursday: montelukast x1 vitamin c x1 vitamin b x1 levocitrizine x1 ; Friday: montelukast x1 levocitrizine x1 ; Saturday: montelukast x1 levocitrizine x1 ",true
Jilan,Hatamleh,"Sunday: allergy relief x1 probiotics x2 ; Monday: allergy relief x1 probiotics x2 ; Tuesday: allergy relief x1 probiotics x2 ; Wednesday: allergy relief x1 ; Thursday: allergy relief x1 ; Friday: allergy relief x1 ; Saturday: allergy relief x1 ",false
Mussab,Nusairat,"Sunday: Xyzal x1 ; Monday: Xyzal x1 ; Tuesday: Xyzal x1 ; Wednesday: Xyzal x1 ; Thursday: Xyzal x1 ; Friday: Xyzal x1 ; Saturday: Xyzal x1 ",true
Mussab,Nusairat,"Sunday: Xyzal x1 ; Monday: Xyzal x1 ; Tuesday: Xyzal x1 ; Wednesday: Xyzal x1 ; Thursday: Xyzal x1 ; Friday: No medication; Saturday: No medication",false
Adam,Smith,"Sunday: Vitamin D x2 ; Monday: Vitamin D x2 ; Tuesday: Vitamin D x2 ; Wednesday: No medication; Thursday: No medication; Friday: No medication; Saturday: No medication",false
Mohammad,Nusairat,"Sunday: Vitamin C x2 ; Monday: Vitamin C x2 ; Tuesday: Vitamin C x2 ; Wednesday: Vitamin C x2 ; Thursday: Vitamin C x2 ; Friday: No medication; Saturday: No medication",true
